<?xml version="1.0" encoding="UTF-8"?>
<xs:schema xmlns:xs="http://www.w3.org/2001/XMLSchema"
           elementFormDefault="qualified">

    <xs:simpleType name="cuisineType">
        <xs:restriction base="xs:string">
            <xs:enumeration value="Italian"/>
            <xs:enumeration value="Asian"/>
            <xs:enumeration value="Mexican"/>
            <xs:enumeration value="French"/>
            <xs:enumeration value="Romanian"/>
            <xs:enumeration value="Indian"/>
            <xs:enumeration value="American"/>
            <xs:enumeration value="Mediterranean"/>
        </xs:restriction>
    </xs:simpleType>

    <xs:simpleType name="difficultyType">
        <xs:restriction base="xs:string">
            <xs:enumeration value="Beginner"/>
            <xs:enumeration value="Intermediate"/>
            <xs:enumeration value="Advanced"/>
        </xs:restriction>
    </xs:simpleType>

    <xs:element name="recipes">
        <xs:complexType>
            <xs:sequence>
                <xs:element name="recipe" maxOccurs="unbounded" minOccurs="1">
                    <xs:complexType>
                        <xs:sequence>
                            <xs:element name="id" type="xs:int"/>
                            <xs:element name="title" type="xs:string"/>
                            <xs:element name="cuisineType1" type="cuisineType"/>
                            <xs:element name="cuisineType2" type="cuisineType"/>
                            <xs:element name="difficulty" type="difficultyType"/>
                        </xs:sequence>
                    </xs:complexType>
                </xs:element>
            </xs:sequence>
        </xs:complexType>
    </xs:element>
</xs:schema>

